<<<<<<< HEAD
<!DOCTYPE Library [

<!ELEMENT Library (Book+,Member+)>
<!ELEMENT Book (Title,Author,Price,Publisher,Gost)>
<!ELEMENT Title (#PCDATA)>
<!ELEMENT Author (#PCDATA)>
<!ELEMENT Price (#PCDATA)>
<!ELEMENT Publisher (#PCDATA)>
<!ELEMENT Gost (#PCDATA)>
<!ELEMENT Member (Name,Address)>
<!ELEMENT Name (FirstName,MiddleName,LastName)>
<!ELEMENT FirstName (#PCDATA)>
<!ELEMENT MiddleName (#PCDATA)>
<!ELEMENT LastName (#PCDATA)>
<!ELEMENT Address (HouseNumber,Street,City)>
<!ELEMENT HouseNumber (#PCDATA)>
<!ELEMENT Street (#PCDATA)>
<!ELEMENT City (#PCDATA)>

<!ATTLIST Book BookId CDATA "000000"> 

=======
<!DOCTYPE Library [

<!ELEMENT Library (Book+,Member+)>
<!ELEMENT Book (Title,Author,Price,Publisher,Gost)>
<!ELEMENT Title (#PCDATA)>
<!ELEMENT Author (#PCDATA)>
<!ELEMENT Price (#PCDATA)>
<!ELEMENT Publisher (#PCDATA)>
<!ELEMENT Gost (#PCDATA)>
<!ELEMENT Member (Name,Address)>
<!ELEMENT Name (FirstName,MiddleName,LastName)>
<!ELEMENT FirstName (#PCDATA)>
<!ELEMENT MiddleName (#PCDATA)>
<!ELEMENT LastName (#PCDATA)>
<!ELEMENT Address (HouseNumber,Street,City)>
<!ELEMENT HouseNumber (#PCDATA)>
<!ELEMENT Street (#PCDATA)>
<!ELEMENT City (#PCDATA)>

<!ATTLIST Book BookId CDATA "000000"> 

>>>>>>> 9ae124e732f83e07e53e031a1b9e8ec6526084b8
]>